<?xml version="1.0" encoding="UTF-8"?>
<hb:RuleSet xmlns:hb="HANDBOOK" xmlns:xsi="http://www.w3.org/2001/XMLSchema-instance" xsi:schemaLocation="HANDBOOK ../XSD/handbook.xsd ">
	<hb:RuleParams>
		<hb:IntParam>
			<hb:ParamID>P1</hb:ParamID>
			<hb:Relation>GT</hb:Relation>
			<hb:Value>8</hb:Value>
		</hb:IntParam>
		<hb:IntParam>
			<hb:ParamID>P2</hb:ParamID>
			<hb:Relation>LET</hb:Relation>
			<hb:Value>-5</hb:Value>
		</hb:IntParam>
	</hb:RuleParams>	
</hb:RuleSet>
